cluster-id,takeaways
0,"Participants expressed concerns about the potential misuse of AI technologies for unauthorized reproduction and copyright infringement, particularly in the context of generating content. Issues highlighted include the need for clearer regulations, protection of creators' rights, and prevention of AI-generated content being claimed as original work. There were also discussions on the impact of AI on employment, the need for stronger regulations to prevent misuse, and the importance of considering ethical implications, such as privacy violations and misinformation dissemination. Overall, there is a call for a balanced approach that addresses these concerns while promoting innovation and creativity in AI development."
5,"Participants highlighted the need for fair compensation in AI-generated content, transparency in image sources, protection of creators' rights, and prevention of AI misuse like deepfakes and plagiarism. They emphasized the importance of clear attribution, legal safeguards for creators, and ethical considerations in AI development to prevent exploitation and misinformation. The call for regulations to ensure fairness, respect for intellectual property, and permission from creators in AI training datasets was a recurring theme throughout the discussion."
6,"Participants expressed concerns about the impact of AI-generated content on the art industry, highlighting issues such as copyright infringement, devaluation of human-created works, and potential harm to creators' livelihoods. They emphasized the need for legal regulations to address misuse and unauthorized replication of creative works by AI systems. Additionally, participants raised worries about the lack of uniqueness and emotional depth in AI-generated content, as well as the potential decline in the quality of visual expressions and societal indifference towards traditional art forms. The discussion also touched on the ethical implications of using AI to replicate specific artists' styles and the need to protect creators from exploitation and unauthorized use of their work."
2,"Participants highlighted the need for regulations to address copyright infringement by AI, emphasizing the importance of ethical guidelines, penalties for misuse, and clear distinctions between commercial and research use. They called for legal mechanisms to protect creators from unauthorized use of AI-generated content and stressed the importance of proper compensation and disclosure in AI-generated works. Stricter legislation, an opt-in approach for data collection, and limitations on AI use were proposed to prevent exploitation and ensure responsible AI usage. Overall, the focus was on safeguarding creators' rights, preventing misuse, and promoting ethical AI practices in society."
1,"Participants highlighted the importance of AI technology for future generations, emphasizing its role in improving work efficiency, aiding in artistic expression, and supporting individuals with disabilities. They discussed the benefits of AI in various fields, such as simplifying tasks, enhancing creativity, and optimizing energy grids. Concerns were raised about the impact of AI on traditional art value, uniqueness of work, and potential job displacement in certain industries. Overall, the consensus was on the rapid advancement of AI technology and the need to adapt to its capabilities in the current era."
4,"Participants expressed concerns about AI-generated content infringing on copyright laws and the rights of creators. They emphasized the need for strict regulations to prevent misuse, including prohibiting unauthorized use of training data and ensuring that AI creations do not receive copyright protection. There was a strong stance against using AI for malicious purposes like creating fake news or harassing individuals, with a call to respect the dignity of creators and avoid imitation that undermines their work. Overall, the consensus was to protect the interests of copyright holders and prevent unauthorized reproduction of creative works through AI technology."
3,"Participants highlighted the importance of respecting copyright laws and protecting the rights of voice actors and creators. They emphasized the need for legislation, stronger penalties, and public awareness to address unauthorized use of voice data for AI generation. The discussions underscored the potential financial losses, devaluation of work, and infringement on personal rights that can result from unauthorized voice data usage. Overall, there was a call for regulations to safeguard the dignity and livelihoods of voice actors and narrators, emphasizing the significance of prioritizing human rights and creators' rights in AI voice synthesis practices."
