cluster-id,takeaways
6,"Participants highlighted the need for Japan to regulate AI development to prevent negative impacts on industries and the economy, emphasizing the importance of concrete plans for AI benefits and aligning regulations with global trends. They stressed public awareness campaigns on copyright laws, the promotion of AI for work efficiency, and the integration of AI into society. Concerns were raised about protecting creators from AI-generated content, the challenge AI poses to Japanese culture, and the potential disruption caused by anti-learning systems like Glaze. The call for unique AI regulations to safeguard young creators and intellectual property rights was also emphasized to foster artistic innovation and ensure fair compensation."
2,"Participants highlighted the importance of obtaining consent from creators for AI-generated datasets, establishing clear guidelines to differentiate between imitation and original expression, respecting creators' rights, ensuring transparency in data sources, preventing misuse through guidelines and warnings, and embedding digital signatures for protection. They emphasized the need for ethical AI development, transparency, attribution, and legal consequences for non-compliance to safeguard intellectual property rights and prevent inappropriate content generation. Additionally, concerns were raised about illegal content in AI datasets, the impact on creators' financial and social standing, and the necessity for clean datasets to advance AI responsibly."
1,"Participants highlighted the importance of compensating creators for dataset usage, expressed concerns about AI generating content without consent, and debated the implications of copyright laws on AI development. They emphasized the need for regulations to protect creators' rights, prevent copyright infringement, and ensure fair compensation for the use of copyrighted materials in AI training. Discussions also touched on the potential negative impacts of AI on cultural development and the livelihood of copyright holders. Overall, the participants called for a balance between AI innovation and respecting intellectual property rights to support a thriving creative industry."
3,"Participants expressed concerns about the impact of AI on creativity, copyright infringement, and ethical considerations. They highlighted issues such as unauthorized use of AI-generated content, potential harm to creators' reputation, and the need for clear regulations and penalties for misuse. The discussions emphasized the importance of respecting artists' hard work, acknowledging their efforts, and ensuring that AI-generated content is not used without permission or proper attribution. Additionally, there were concerns about the potential for AI to replicate unique styles, leading to challenges for young artists and creators in the industry. Overall, the dialogue underscored the complex intersection of AI technology, artistic expression, and intellectual property rights that require careful consideration and ethical guidelines."
5,"Participants highlighted the need for specific regulations on AI, emphasizing the importance of fair treatment, education, and shared responsibility in addressing AI-related issues. Concerns were raised about potential criminal activities involving AI, the impact on creativity, and the challenges in defining boundaries for AI development. It was noted that regulations should be carefully crafted to prevent misuse while acknowledging the positive impact of AI in various fields. Additionally, the importance of protecting victims' rights and promoting a fair legal framework for addressing AI involvement in illegal activities was emphasized."
4,"The discussion on AI regulation highlighted the need to balance promoting innovation with protecting creators' rights. Suggestions included licensing for dissemination, fair compensation, and involving creators in AI development. Emphasis was placed on preventing misuse, supporting existing creators, and fostering a harmonious relationship between AI and human creators. Challenges in regulating AI were acknowledged, with a focus on addressing the current unregulated environment to safeguard honest creators."
0,"Participants highlighted the necessity for clear guidelines at the intersection of AI and copyright laws, emphasizing the need for flexible revisions to address AI-generated content mimicking artists' styles. They proposed legal recognition for AI, stricter regulations requiring permission from copyright holders for AI learning, and enhanced penalties for copyright infringement. The focus was on protecting creators from piracy, regulating AI use on copyrighted materials, and establishing enforcement measures and penalties for violators. The call for international regulations to safeguard copyright holders' rights against AI systems exploiting non-copyrightable materials was also emphasized. Overall, the discussion underscored the urgency of updating copyright laws to address the challenges posed by AI technology."
